{
  "schemaVersion": "2.0.0",
  "batchId": "b2-grammar-past-perfect-simple-continuous-swipe-deck-001",
  "level": "B2",
  "category": "grammar",
  "topic": "past-tenses",
  "subtopic": "past-perfect-simple-vs-continuous",
  "lessonId": "b2-grammar-past-perfect-simple-continuous",
  "activityType": "swipe_deck",
  "activities": [
    {
      "schemaVersion": "2.0.0",
      "id": "b2-grammar-past-perfect-simple-continuous-sd-044",
      "status": "published",
      "autoGradable": true,
      "level": "B2",
      "type": "swipe_deck",
      "skillFocus": "swipe_deck",
      "category": "grammar",
      "topic": "past-tenses",
      "subtopic": "past-perfect-simple-vs-continuous",
      "taxonomyNodeIds": [
        "past-perfect-simple-vs-continuous"
      ],
      "difficulty": 3,
      "instructions": "Desliza a la derecha si la frase es correcta y a la izquierda si no lo es.",
      "prompt": "Mazo de 5 afirmaciones para repasar el tema.",
      "cards": [
        {
          "id": "c1",
          "statement": "I had been weighing the proposal.",
          "explanation": "El proceso usa el continuo."
        },
        {
          "id": "c2",
          "statement": "I had been possessing that house for years.",
          "explanation": "«possess» es un verbo de estado."
        },
        {
          "id": "c3",
          "statement": "He had posted the letter by noon.",
          "explanation": "La cantidad completada usa el simple."
        },
        {
          "id": "c4",
          "statement": "I had mended the fence.",
          "explanation": "El resultado terminado usa el simple."
        },
        {
          "id": "c5",
          "statement": "I had devoured the entire novel.",
          "explanation": "La cantidad completada usa el simple."
        }
      ],
      "lessonIds": [
        "b2-grammar-past-perfect-simple-continuous"
      ],
      "tags": [
        "b2",
        "past-perfect",
        "true-false",
        "swipe-deck"
      ],
      "estimatedSeconds": 60,
      "evaluator": {
        "strategy": "deck_booleans",
        "cards": [
          {
            "cardId": "c1",
            "correct": true
          },
          {
            "cardId": "c2",
            "correct": false
          },
          {
            "cardId": "c3",
            "correct": true
          },
          {
            "cardId": "c4",
            "correct": true
          },
          {
            "cardId": "c5",
            "correct": true
          }
        ]
      },
      "explanation": "Cada carta repasa una regla del tema; revisa las falladas al terminar el mazo."
    },
    {
      "schemaVersion": "2.0.0",
      "id": "b2-grammar-past-perfect-simple-continuous-sd-107",
      "status": "published",
      "autoGradable": true,
      "level": "B2",
      "type": "swipe_deck",
      "skillFocus": "swipe_deck",
      "category": "grammar",
      "topic": "past-tenses",
      "subtopic": "past-perfect-simple-vs-continuous",
      "taxonomyNodeIds": [
        "past-perfect-simple-vs-continuous"
      ],
      "difficulty": 3,
      "instructions": "Desliza a la derecha si la frase es correcta y a la izquierda si no lo es.",
      "prompt": "Mazo de 6 afirmaciones para repasar el tema.",
      "cards": [
        {
          "id": "c1",
          "statement": "He had been drafting two essays.",
          "explanation": "La cantidad completada usa el simple."
        },
        {
          "id": "c2",
          "statement": "The bus had gone before we reached the stop.",
          "explanation": "El evento completado usa el simple."
        },
        {
          "id": "c3",
          "statement": "I had been mending the fence all afternoon.",
          "explanation": "La actividad en curso usa el continuo."
        },
        {
          "id": "c4",
          "statement": "His hands were dirty; he had been repairing the engine.",
          "explanation": "El efecto visible usa el continuo."
        },
        {
          "id": "c5",
          "statement": "She had been finishing the letter.",
          "explanation": "El resultado terminado usa el simple."
        },
        {
          "id": "c6",
          "statement": "She had polished the windows.",
          "explanation": "El resultado terminado usa el simple."
        }
      ],
      "lessonIds": [
        "b2-grammar-past-perfect-simple-continuous"
      ],
      "tags": [
        "b2",
        "past-perfect",
        "true-false",
        "swipe-deck"
      ],
      "estimatedSeconds": 72,
      "evaluator": {
        "strategy": "deck_booleans",
        "cards": [
          {
            "cardId": "c1",
            "correct": false
          },
          {
            "cardId": "c2",
            "correct": true
          },
          {
            "cardId": "c3",
            "correct": true
          },
          {
            "cardId": "c4",
            "correct": true
          },
          {
            "cardId": "c5",
            "correct": false
          },
          {
            "cardId": "c6",
            "correct": true
          }
        ]
      },
      "explanation": "Cada carta repasa una regla del tema; revisa las falladas al terminar el mazo."
    },
    {
      "schemaVersion": "2.0.0",
      "id": "b2-grammar-past-perfect-simple-continuous-sd-170",
      "status": "published",
      "autoGradable": true,
      "level": "B2",
      "type": "swipe_deck",
      "skillFocus": "swipe_deck",
      "category": "grammar",
      "topic": "past-tenses",
      "subtopic": "past-perfect-simple-vs-continuous",
      "taxonomyNodeIds": [
        "past-perfect-simple-vs-continuous"
      ],
      "difficulty": 4,
      "instructions": "Desliza a la derecha si la frase es correcta y a la izquierda si no lo es.",
      "prompt": "Mazo de 7 afirmaciones para repasar el tema.",
      "cards": [
        {
          "id": "c1",
          "statement": "I had been residing abroad for a decade.",
          "explanation": "La duración con «for» usa el continuo."
        },
        {
          "id": "c2",
          "statement": "I had been searching for ages.",
          "explanation": "La duración usa el continuo."
        },
        {
          "id": "c3",
          "statement": "She had been rehearsing the speech all week.",
          "explanation": "La actividad en curso usa el continuo."
        },
        {
          "id": "c4",
          "statement": "I had been locking the gate all morning.",
          "explanation": "La actividad en curso usa el continuo."
        },
        {
          "id": "c5",
          "statement": "I had been hearing that song before.",
          "explanation": "«hear» como experiencia usa el simple."
        },
        {
          "id": "c6",
          "statement": "We had toured the gallery.",
          "explanation": "La cantidad completada usa el simple."
        },
        {
          "id": "c7",
          "statement": "They had been queuing since dawn.",
          "explanation": "La duración usa el continuo."
        }
      ],
      "lessonIds": [
        "b2-grammar-past-perfect-simple-continuous"
      ],
      "tags": [
        "b2",
        "past-perfect",
        "true-false",
        "swipe-deck"
      ],
      "estimatedSeconds": 84,
      "evaluator": {
        "strategy": "deck_booleans",
        "cards": [
          {
            "cardId": "c1",
            "correct": true
          },
          {
            "cardId": "c2",
            "correct": true
          },
          {
            "cardId": "c3",
            "correct": true
          },
          {
            "cardId": "c4",
            "correct": true
          },
          {
            "cardId": "c5",
            "correct": false
          },
          {
            "cardId": "c6",
            "correct": true
          },
          {
            "cardId": "c7",
            "correct": true
          }
        ]
      },
      "explanation": "Cada carta repasa una regla del tema; revisa las falladas al terminar el mazo."
    }
  ]
}
