{
  "schemaVersion": "2.0.0",
  "batchId": "b2-vocabulary-science-research-swipe-deck-001",
  "level": "B2",
  "category": "vocabulary",
  "topic": "b2-science-research",
  "subtopic": "b2-science-research",
  "lessonId": "b2-vocabulary-science-research",
  "activityType": "swipe_deck",
  "activities": [
    {
      "schemaVersion": "2.0.0",
      "id": "b2-vocabulary-science-research-sd-061",
      "status": "published",
      "autoGradable": true,
      "level": "B2",
      "type": "swipe_deck",
      "skillFocus": "swipe_deck",
      "category": "vocabulary",
      "topic": "b2-science-research",
      "subtopic": "b2-science-research",
      "taxonomyNodeIds": [
        "b2-science-research"
      ],
      "difficulty": 3,
      "instructions": "Desliza a la derecha si la frase es correcta y a la izquierda si no lo es.",
      "prompt": "Mazo de 5 afirmaciones para repasar el tema.",
      "cards": [
        {
          "id": "c1",
          "statement": "Findings are the results or discoveries presented by a study.",
          "explanation": "Findings report what the study found."
        },
        {
          "id": "c2",
          "statement": "Researchers collect data before they can analyse it.",
          "explanation": "Collection precedes analysis in a typical study."
        },
        {
          "id": "c3",
          "statement": "Qualitative research often uses interviews or observations.",
          "explanation": "Qualitative methods explore experiences and meanings."
        },
        {
          "id": "c4",
          "statement": "Publishing findings makes them available to an academic audience.",
          "explanation": "Publication communicates results to readers and peers."
        },
        {
          "id": "c5",
          "statement": "To challenge an assumption is to accept it without question.",
          "explanation": "Challenge means question or test its validity."
        }
      ],
      "lessonIds": [
        "b2-vocabulary-science-research"
      ],
      "tags": [
        "b2",
        "findings",
        "swipe-deck"
      ],
      "estimatedSeconds": 60,
      "evaluator": {
        "strategy": "deck_booleans",
        "cards": [
          {
            "cardId": "c1",
            "correct": true
          },
          {
            "cardId": "c2",
            "correct": true
          },
          {
            "cardId": "c3",
            "correct": true
          },
          {
            "cardId": "c4",
            "correct": true
          },
          {
            "cardId": "c5",
            "correct": false
          }
        ]
      },
      "explanation": "Cada carta repasa una regla del tema; revisa las falladas al terminar el mazo."
    },
    {
      "schemaVersion": "2.0.0",
      "id": "b2-vocabulary-science-research-sd-124",
      "status": "published",
      "autoGradable": true,
      "level": "B2",
      "type": "swipe_deck",
      "skillFocus": "swipe_deck",
      "category": "vocabulary",
      "topic": "b2-science-research",
      "subtopic": "b2-science-research",
      "taxonomyNodeIds": [
        "b2-science-research"
      ],
      "difficulty": 5,
      "instructions": "Desliza a la derecha si la frase es correcta y a la izquierda si no lo es.",
      "prompt": "Mazo de 6 afirmaciones para repasar el tema.",
      "cards": [
        {
          "id": "c1",
          "statement": "Peer review is evaluation by specialists in the field.",
          "explanation": "Peers assess a paper before publication."
        },
        {
          "id": "c2",
          "statement": "A representative sample accurately reflects the wider group being studied.",
          "explanation": "Representativeness is the key idea."
        },
        {
          "id": "c3",
          "statement": "A valid test measures the concept it is intended to measure.",
          "explanation": "Validity concerns the accuracy of the measure."
        },
        {
          "id": "c4",
          "statement": "Drawing a conclusion is different from simply collecting data.",
          "explanation": "A conclusion interprets data rather than merely gathering it."
        },
        {
          "id": "c5",
          "statement": "A theory is normally broader than a single testable hypothesis.",
          "explanation": "Theories provide broad explanatory frameworks."
        },
        {
          "id": "c6",
          "statement": "Replicating a study can help test whether its results are reproducible.",
          "explanation": "Reproducibility is a key reason for replication."
        }
      ],
      "lessonIds": [
        "b2-vocabulary-science-research"
      ],
      "tags": [
        "b2",
        "peer-review",
        "swipe-deck"
      ],
      "estimatedSeconds": 72,
      "evaluator": {
        "strategy": "deck_booleans",
        "cards": [
          {
            "cardId": "c1",
            "correct": true
          },
          {
            "cardId": "c2",
            "correct": true
          },
          {
            "cardId": "c3",
            "correct": true
          },
          {
            "cardId": "c4",
            "correct": true
          },
          {
            "cardId": "c5",
            "correct": true
          },
          {
            "cardId": "c6",
            "correct": true
          }
        ]
      },
      "explanation": "Cada carta repasa una regla del tema; revisa las falladas al terminar el mazo."
    },
    {
      "schemaVersion": "2.0.0",
      "id": "b2-vocabulary-science-research-sd-187",
      "status": "published",
      "autoGradable": true,
      "level": "B2",
      "type": "swipe_deck",
      "skillFocus": "swipe_deck",
      "category": "vocabulary",
      "topic": "b2-science-research",
      "subtopic": "b2-science-research",
      "taxonomyNodeIds": [
        "b2-science-research"
      ],
      "difficulty": 3,
      "instructions": "Desliza a la derecha si la frase es correcta y a la izquierda si no lo es.",
      "prompt": "Mazo de 7 afirmaciones para repasar el tema.",
      "cards": [
        {
          "id": "c1",
          "statement": "Make a claim is a natural academic collocation.",
          "explanation": "Researchers make or support claims."
        },
        {
          "id": "c2",
          "statement": "Preliminary results are necessarily final and fully confirmed.",
          "explanation": "Preliminary means not yet final."
        },
        {
          "id": "c3",
          "statement": "Statistically significant has a specialised research meaning.",
          "explanation": "It does not simply mean important in everyday terms."
        },
        {
          "id": "c4",
          "statement": "A controlled variable is deliberately allowed to change without measurement.",
          "explanation": "A controlled variable is kept stable or managed."
        },
        {
          "id": "c5",
          "statement": "Replication means repeating a study or experiment.",
          "explanation": "Replication tests whether results can be reproduced."
        },
        {
          "id": "c6",
          "statement": "Reliable measurements are consistent when repeated.",
          "explanation": "Reliability concerns consistency."
        },
        {
          "id": "c7",
          "statement": "Analyse data means examine data systematically.",
          "explanation": "Analysis identifies patterns and relationships."
        }
      ],
      "lessonIds": [
        "b2-vocabulary-science-research"
      ],
      "tags": [
        "b2",
        "claim",
        "swipe-deck"
      ],
      "estimatedSeconds": 84,
      "evaluator": {
        "strategy": "deck_booleans",
        "cards": [
          {
            "cardId": "c1",
            "correct": true
          },
          {
            "cardId": "c2",
            "correct": false
          },
          {
            "cardId": "c3",
            "correct": true
          },
          {
            "cardId": "c4",
            "correct": false
          },
          {
            "cardId": "c5",
            "correct": true
          },
          {
            "cardId": "c6",
            "correct": true
          },
          {
            "cardId": "c7",
            "correct": true
          }
        ]
      },
      "explanation": "Cada carta repasa una regla del tema; revisa las falladas al terminar el mazo."
    }
  ]
}
